root@lamp-ubuntu-s-1vcpu-1gb-tor1-01:~# tcpdump -n -i eth0
tcpdump: verbose output suppressed, use -v[v]... for full protocol decode
listening on eth0, link-type EN10MB (Ethernet), snapshot length 262144 bytes
03:25:44.730732 IP 167.99.185.35.22 > 162.243.188.66.27755: Flags [P.], seq 3171497261:3171497325, ack 744078782, win 502, options [nop,nop,TS val 2243019561 ecr 3156500562], length 64
03:25:44.731349 IP 167.99.185.35.22 > 162.243.188.66.27755: Flags [P.], seq 64:192, ack 1, win 502, options [nop,nop,TS val 2243019561 ecr 3156500562], length 128
03:25:44.731398 IP 167.99.185.35.22 > 162.243.188.66.27755: Flags [P.], seq 192:256, ack 1, win 502, options [nop,nop,TS val 2243019561 ecr 3156500562], length 64
03:25:44.731443 IP 167.99.185.35.22 > 162.243.188.66.27755: Flags [P.], seq 256:336, ack 1, win 502, options [nop,nop,TS val 2243019561 ecr 3156500562], length 80
03:25:44.731483 IP 167.99.185.35.22 > 162.243.188.66.27755: Flags [P.], seq 336:416, ack 1, win 502, options [nop,nop,TS val 2243019561 ecr 3156500562], length 80
03:25:44.731527 IP 167.99.185.35.22 > 162.243.188.66.27755: Flags [P.], seq 416:496, ack 1, win 502, options [nop,nop,TS val 2243019562 ecr 3156500562], length 80
03:25:44.731555 IP 167.99.185.35.22 > 162.243.188.66.27755: Flags [P.], seq 496:560, ack 1, win 502, options [nop,nop,TS val 2243019562 ecr 3156500562], length 64
03:25:44.743724 IP 162.243.188.66.27755 > 167.99.185.35.22: Flags [.], ack 64, win 501, options [nop,nop,TS val 3156500581 ecr 2243019561], length 0
03:25:44.744032 IP 162.243.188.66.27755 > 167.99.185.35.22: Flags [.], ack 192, win 501, options [nop,nop,TS val 3156500581 ecr 2243019561], length 0
03:25:44.744032 IP 162.243.188.66.27755 > 167.99.185.35.22: Flags [.], ack 256, win 501, options [nop,nop,TS val 3156500581 ecr 2243019561], length 0
03:25:44.744118 IP 162.243.188.66.27755 > 167.99.185.35.22: Flags [.], ack 336, win 501, options [nop,nop,TS val 3156500581 ecr 2243019561], length 0
03:25:44.744118 IP 162.243.188.66.27755 > 167.99.185.35.22: Flags [.], ack 416, win 501, options [nop,nop,TS val 3156500581 ecr 2243019561], length 0
03:25:44.744118 IP 162.243.188.66.27755 > 167.99.185.35.22: Flags [.], ack 496, win 501, options [nop,nop,TS val 3156500581 ecr 2243019562], length 0
03:25:44.744183 IP 162.243.188.66.27755 > 167.99.185.35.22: Flags [.], ack 560, win 501, options [nop,nop,TS val 3156500581 ecr 2243019562], length 0
03:25:44.829843 IP 167.99.185.35.22 > 162.243.188.66.27755: Flags [P.], seq 560:800, ack 1, win 502, options [nop,nop,TS val 2243019660 ecr 3156500581], length 240
03:25:44.829911 IP 167.99.185.35.22 > 162.243.188.66.27755: Flags [P.], seq 800:864, ack 1, win 502, options [nop,nop,TS val 2243019660 ecr 3156500581], length 64
03:25:44.829963 IP 167.99.185.35.22 > 162.243.188.66.27755: Flags [P.], seq 864:1088, ack 1, win 502, options [nop,nop,TS val 2243019660 ecr 3156500581], length 224
03:25:44.829992 IP 167.99.185.35.22 > 162.243.188.66.27755: Flags [P.], seq 1088:1152, ack 1, win 502, options [nop,nop,TS val 2243019660 ecr 3156500581], length 64
03:25:44.830032 IP 167.99.185.35.22 > 162.243.188.66.27755: Flags [P.], seq 1152:1376, ack 1, win 502, options [nop,nop,TS val 2243019660 ecr 3156500581], length 224
03:25:44.830060 IP 167.99.185.35.22 > 162.243.188.66.27755: Flags [P.], seq 1376:1440, ack 1, win 502, options [nop,nop,TS val 2243019660 ecr 3156500581], length 64
03:25:44.830114 IP 167.99.185.35.22 > 162.243.188.66.27755: Flags [P.], seq 1440:1664, ack 1, win 502, options [nop,nop,TS val 2243019660 ecr 3156500581], length 224
03:25:44.830155 IP 167.99.185.35.22 > 162.243.188.66.27755: Flags [P.], seq 1664:1728, ack 1, win 502, options [nop,nop,TS val 2243019660 ecr 3156500581], length 64
03:25:44.830210 IP 167.99.185.35.22 > 162.243.188.66.27755: Flags [P.], seq 1728:1952, ack 1, win 502, options [nop,nop,TS val 2243019660 ecr 3156500581], length 224
03:25:44.830243 IP 167.99.185.35.22 > 162.243.188.66.27755: Flags [P.], seq 1952:2016, ack 1, win 502, options [nop,nop,TS val 2243019660 ecr 3156500581], length 64
03:25:44.830372 IP 167.99.185.35.22 > 162.243.188.66.27755: Flags [P.], seq 2016:2240, ack 1, win 502, options [nop,nop,TS val 2243019660 ecr 3156500581], length 224
03:25:44.830417 IP 167.99.185.35.22 > 162.243.188.66.27755: Flags [P.], seq 2240:2304, ack 1, win 502, options [nop,nop,TS val 2243019660 ecr 3156500581], length 64
03:25:44.830467 IP 167.99.185.35.22 > 162.243.188.66.27755: Flags [P.], seq 2304:2528, ack 1, win 502, options [nop,nop,TS val 2243019660 ecr 3156500581], length 224
03:25:44.830495 IP 167.99.185.35.22 > 162.243.188.66.27755: Flags [P.], seq 2528:2592, ack 1, win 502, options [nop,nop,TS val 2243019660 ecr 3156500581], length 64
03:25:44.843045 IP 162.243.188.66.27755 > 167.99.185.35.22: Flags [.], ack 800, win 501, options [nop,nop,TS val 3156500680 ecr 2243019660], length 0
03:25:44.843046 IP 162.243.188.66.27755 > 167.99.185.35.22: Flags [.], ack 864, win 501, options [nop,nop,TS val 3156500680 ecr 2243019660], length 0
03:25:44.843103 IP 167.99.185.35.22 > 162.243.188.66.27755: Flags [P.], seq 2592:4496, ack 1, win 502, options [nop,nop,TS val 2243019673 ecr 3156500680], length 1904
03:25:44.843316 IP 162.243.188.66.27755 > 167.99.185.35.22: Flags [.], ack 1088, win 501, options [nop,nop,TS val 3156500680 ecr 2243019660], length 0
03:25:44.843316 IP 162.243.188.66.27755 > 167.99.185.35.22: Flags [.], ack 1152, win 501, options [nop,nop,TS val 3156500680 ecr 2243019660], length 0
03:25:44.843316 IP 162.243.188.66.27755 > 167.99.185.35.22: Flags [.], ack 1376, win 501, options [nop,nop,TS val 3156500680 ecr 2243019660], length 0
03:25:44.843316 IP 162.243.188.66.27755 > 167.99.185.35.22: Flags [.], ack 1440, win 501, options [nop,nop,TS val 3156500680 ecr 2243019660], length 0
03:25:44.843316 IP 162.243.188.66.27755 > 167.99.185.35.22: Flags [.], ack 1664, win 501, options [nop,nop,TS val 3156500680 ecr 2243019660], length 0
03:25:44.843316 IP 162.243.188.66.27755 > 167.99.185.35.22: Flags [.], ack 1728, win 501, options [nop,nop,TS val 3156500680 ecr 2243019660], length 0
03:25:44.843316 IP 162.243.188.66.27755 > 167.99.185.35.22: Flags [.], ack 1952, win 501, options [nop,nop,TS val 3156500680 ecr 2243019660], length 0
03:25:44.856073 IP 162.243.188.66.27755 > 167.99.185.35.22: Flags [.], ack 4040, win 501, options [nop,nop,TS val 3156500693 ecr 2243019660], length 0
03:25:44.871737 IP 162.243.188.66.27755 > 167.99.185.35.22: Flags [.], ack 4496, win 501, options [nop,nop,TS val 3156500709 ecr 2243019673], length 0
03:25:44.933829 IP 167.99.185.35.22 > 162.243.188.66.27755: Flags [P.], seq 4496:4720, ack 1, win 502, options [nop,nop,TS val 2243019764 ecr 3156500709], length 224
03:25:44.933955 IP 167.99.185.35.22 > 162.243.188.66.27755: Flags [P.], seq 4720:4784, ack 1, win 502, options [nop,nop,TS val 2243019764 ecr 3156500709], length 64
03:25:44.934034 IP 167.99.185.35.22 > 162.243.188.66.27755: Flags [P.], seq 4784:5008, ack 1, win 502, options [nop,nop,TS val 2243019764 ecr 3156500709], length 224
03:25:44.934065 IP 167.99.185.35.22 > 162.243.188.66.27755: Flags [P.], seq 5008:5072, ack 1, win 502, options [nop,nop,TS val 2243019764 ecr 3156500709], length 64
03:25:44.934108 IP 167.99.185.35.22 > 162.243.188.66.27755: Flags [P.], seq 5072:5296, ack 1, win 502, options [nop,nop,TS val 2243019764 ecr 3156500709], length 224
03:25:44.934151 IP 167.99.185.35.22 > 162.243.188.66.27755: Flags [P.], seq 5296:5360, ack 1, win 502, options [nop,nop,TS val 2243019764 ecr 3156500709], length 64
03:25:44.934185 IP 167.99.185.35.22 > 162.243.188.66.27755: Flags [P.], seq 5360:5584, ack 1, win 502, options [nop,nop,TS val 2243019764 ecr 3156500709], length 224
03:25:44.934211 IP 167.99.185.35.22 > 162.243.188.66.27755: Flags [P.], seq 5584:5648, ack 1, win 502, options [nop,nop,TS val 2243019764 ecr 3156500709], length 64
03:25:44.934249 IP 167.99.185.35.22 > 162.243.188.66.27755: Flags [P.], seq 5648:5872, ack 1, win 502, options [nop,nop,TS val 2243019764 ecr 3156500709], length 224
03:25:44.934276 IP 167.99.185.35.22 > 162.243.188.66.27755: Flags [P.], seq 5872:5936, ack 1, win 502, options [nop,nop,TS val 2243019764 ecr 3156500709], length 64
03:25:44.934313 IP 167.99.185.35.22 > 162.243.188.66.27755: Flags [P.], seq 5936:6160, ack 1, win 502, options [nop,nop,TS val 2243019764 ecr 3156500709], length 224
03:25:44.934339 IP 167.99.185.35.22 > 162.243.188.66.27755: Flags [P.], seq 6160:6224, ack 1, win 502, options [nop,nop,TS val 2243019764 ecr 3156500709], length 64
03:25:44.934375 IP 167.99.185.35.22 > 162.243.188.66.27755: Flags [P.], seq 6224:6448, ack 1, win 502, options [nop,nop,TS val 2243019764 ecr 3156500709], length 224
03:25:44.934403 IP 167.99.185.35.22 > 162.243.188.66.27755: Flags [P.], seq 6448:6512, ack 1, win 502, options [nop,nop,TS val 2243019764 ecr 3156500709], length 64
03:25:44.934439 IP 167.99.185.35.22 > 162.243.188.66.27755: Flags [P.], seq 6512:6736, ack 1, win 502, options [nop,nop,TS val 2243019764 ecr 3156500709], length 224
03:25:44.934466 IP 167.99.185.35.22 > 162.243.188.66.27755: Flags [P.], seq 6736:6800, ack 1, win 502, options [nop,nop,TS val 2243019764 ecr 3156500709], length 64
03:25:44.934503 IP 167.99.185.35.22 > 162.243.188.66.27755: Flags [P.], seq 6800:7024, ack 1, win 502, options [nop,nop,TS val 2243019764 ecr 3156500709], length 224
03:25:44.934530 IP 167.99.185.35.22 > 162.243.188.66.27755: Flags [P.], seq 7024:7088, ack 1, win 502, options [nop,nop,TS val 2243019765 ecr 3156500709], length 64
03:25:44.934568 IP 167.99.185.35.22 > 162.243.188.66.27755: Flags [P.], seq 7088:7312, ack 1, win 502, options [nop,nop,TS val 2243019765 ecr 3156500709], length 224
03:25:44.934594 IP 167.99.185.35.22 > 162.243.188.66.27755: Flags [P.], seq 7312:7376, ack 1, win 502, options [nop,nop,TS val 2243019765 ecr 3156500709], length 64
03:25:44.934631 IP 167.99.185.35.22 > 162.243.188.66.27755: Flags [P.], seq 7376:7600, ack 1, win 502, options [nop,nop,TS val 2243019765 ecr 3156500709], length 224
03:25:44.934657 IP 167.99.185.35.22 > 162.243.188.66.27755: Flags [P.], seq 7600:7664, ack 1, win 502, options [nop,nop,TS val 2243019765 ecr 3156500709], length 64
03:25:44.934693 IP 167.99.185.35.22 > 162.243.188.66.27755: Flags [P.], seq 7664:7888, ack 1, win 502, options [nop,nop,TS val 2243019765 ecr 3156500709], length 224
03:25:44.934721 IP 167.99.185.35.22 > 162.243.188.66.27755: Flags [P.], seq 7888:7952, ack 1, win 502, options [nop,nop,TS val 2243019765 ecr 3156500709], length 64
03:25:44.934757 IP 167.99.185.35.22 > 162.243.188.66.27755: Flags [P.], seq 7952:8176, ack 1, win 502, options [nop,nop,TS val 2243019765 ecr 3156500709], length 224
03:25:44.934784 IP 167.99.185.35.22 > 162.243.188.66.27755: Flags [P.], seq 8176:8240, ack 1, win 502, options [nop,nop,TS val 2243019765 ecr 3156500709], length 64
03:25:44.934820 IP 167.99.185.35.22 > 162.243.188.66.27755: Flags [P.], seq 8240:8464, ack 1, win 502, options [nop,nop,TS val 2243019765 ecr 3156500709], length 224
03:25:44.934847 IP 167.99.185.35.22 > 162.243.188.66.27755: Flags [P.], seq 8464:8528, ack 1, win 502, options [nop,nop,TS val 2243019765 ecr 3156500709], length 64
03:25:44.934883 IP 167.99.185.35.22 > 162.243.188.66.27755: Flags [P.], seq 8528:8736, ack 1, win 502, options [nop,nop,TS val 2243019765 ecr 3156500709], length 208
03:25:44.934909 IP 167.99.185.35.22 > 162.243.188.66.27755: Flags [P.], seq 8736:8800, ack 1, win 502, options [nop,nop,TS val 2243019765 ecr 3156500709], length 64
03:25:44.946984 IP 162.243.188.66.27755 > 167.99.185.35.22: Flags [.], ack 6160, win 501, options [nop,nop,TS val 3156500784 ecr 2243019764], length 0
03:25:44.947047 IP 167.99.185.35.22 > 162.243.188.66.27755: Flags [P.], seq 8800:11808, ack 1, win 502, options [nop,nop,TS val 2243019777 ecr 3156500784], length 3008
03:25:44.947401 IP 162.243.188.66.27755 > 167.99.185.35.22: Flags [.], ack 7664, win 501, options [nop,nop,TS val 3156500784 ecr 2243019764], length 0
03:25:44.959392 IP 162.243.188.66.27755 > 167.99.185.35.22: Flags [.], ack 8800, win 501, options [nop,nop,TS val 3156500796 ecr 2243019765], length 0
03:25:44.959766 IP 162.243.188.66.27755 > 167.99.185.35.22: Flags [.], ack 11696, win 501, options [nop,nop,TS val 3156500797 ecr 2243019777], length 0
03:25:44.971411 IP 162.243.188.66.27755 > 167.99.185.35.22: Flags [.], ack 11808, win 501, options [nop,nop,TS val 3156500808 ecr 2243019777], length 0
03:25:45.037783 IP 167.99.185.35.22 > 162.243.188.66.27755: Flags [P.], seq 11808:12032, ack 1, win 502, options [nop,nop,TS val 2243019868 ecr 3156500808], length 224
03:25:45.037852 IP 167.99.185.35.22 > 162.243.188.66.27755: Flags [P.], seq 12032:12096, ack 1, win 502, options [nop,nop,TS val 2243019868 ecr 3156500808], length 64
03:25:45.037914 IP 167.99.185.35.22 > 162.243.188.66.27755: Flags [P.], seq 12096:12320, ack 1, win 502, options [nop,nop,TS val 2243019868 ecr 3156500808], length 224
03:25:45.037952 IP 167.99.185.35.22 > 162.243.188.66.27755: Flags [P.], seq 12320:12384, ack 1, win 502, options [nop,nop,TS val 2243019868 ecr 3156500808], length 64
03:25:45.038005 IP 167.99.185.35.22 > 162.243.188.66.27755: Flags [P.], seq 12384:12608, ack 1, win 502, options [nop,nop,TS val 2243019868 ecr 3156500808], length 224
03:25:45.038042 IP 167.99.185.35.22 > 162.243.188.66.27755: Flags [P.], seq 12608:12672, ack 1, win 502, options [nop,nop,TS val 2243019868 ecr 3156500808], length 64
03:25:45.038093 IP 167.99.185.35.22 > 162.243.188.66.27755: Flags [P.], seq 12672:12896, ack 1, win 502, options [nop,nop,TS val 2243019868 ecr 3156500808], length 224
03:25:45.038130 IP 167.99.185.35.22 > 162.243.188.66.27755: Flags [P.], seq 12896:12960, ack 1, win 502, options [nop,nop,TS val 2243019868 ecr 3156500808], length 64
03:25:45.038184 IP 167.99.185.35.22 > 162.243.188.66.27755: Flags [P.], seq 12960:13184, ack 1, win 502, options [nop,nop,TS val 2243019868 ecr 3156500808], length 224
03:25:45.038222 IP 167.99.185.35.22 > 162.243.188.66.27755: Flags [P.], seq 13184:13248, ack 1, win 502, options [nop,nop,TS val 2243019868 ecr 3156500808], length 64
03:25:45.038273 IP 167.99.185.35.22 > 162.243.188.66.27755: Flags [P.], seq 13248:13472, ack 1, win 502, options [nop,nop,TS val 2243019868 ecr 3156500808], length 224
03:25:45.038340 IP 167.99.185.35.22 > 162.243.188.66.27755: Flags [P.], seq 13472:13536, ack 1, win 502, options [nop,nop,TS val 2243019868 ecr 3156500808], length 64
03:25:45.038367 IP 167.99.185.35.22 > 162.243.188.66.27755: Flags [P.], seq 13536:13760, ack 1, win 502, options [nop,nop,TS val 2243019868 ecr 3156500808], length 224
03:25:45.038404 IP 167.99.185.35.22 > 162.243.188.66.27755: Flags [P.], seq 13760:13824, ack 1, win 502, options [nop,nop,TS val 2243019868 ecr 3156500808], length 64
03:25:45.038455 IP 167.99.185.35.22 > 162.243.188.66.27755: Flags [P.], seq 13824:14048, ack 1, win 502, options [nop,nop,TS val 2243019868 ecr 3156500808], length 224
03:25:45.038492 IP 167.99.185.35.22 > 162.243.188.66.27755: Flags [P.], seq 14048:14112, ack 1, win 502, options [nop,nop,TS val 2243019868 ecr 3156500808], length 64
03:25:45.038544 IP 167.99.185.35.22 > 162.243.188.66.27755: Flags [P.], seq 14112:14336, ack 1, win 502, options [nop,nop,TS val 2243019869 ecr 3156500808], length 224
03:25:45.038582 IP 167.99.185.35.22 > 162.243.188.66.27755: Flags [P.], seq 14336:14400, ack 1, win 502, options [nop,nop,TS val 2243019869 ecr 3156500808], length 64
03:25:45.038632 IP 167.99.185.35.22 > 162.243.188.66.27755: Flags [P.], seq 14400:14624, ack 1, win 502, options [nop,nop,TS val 2243019869 ecr 3156500808], length 224
03:25:45.038700 IP 167.99.185.35.22 > 162.243.188.66.27755: Flags [P.], seq 14624:14688, ack 1, win 502, options [nop,nop,TS val 2243019869 ecr 3156500808], length 64
03:25:45.038729 IP 167.99.185.35.22 > 162.243.188.66.27755: Flags [P.], seq 14688:14912, ack 1, win 502, options [nop,nop,TS val 2243019869 ecr 3156500808], length 224
03:25:45.038765 IP 167.99.185.35.22 > 162.243.188.66.27755: Flags [P.], seq 14912:14976, ack 1, win 502, options [nop,nop,TS val 2243019869 ecr 3156500808], length 64
03:25:45.038817 IP 167.99.185.35.22 > 162.243.188.66.27755: Flags [P.], seq 14976:15200, ack 1, win 502, options [nop,nop,TS val 2243019869 ecr 3156500808], length 224
03:25:45.038856 IP 167.99.185.35.22 > 162.243.188.66.27755: Flags [P.], seq 15200:15264, ack 1, win 502, options [nop,nop,TS val 2243019869 ecr 3156500808], length 64
03:25:45.038911 IP 167.99.185.35.22 > 162.243.188.66.27755: Flags [P.], seq 15264:15488, ack 1, win 502, options [nop,nop,TS val 2243019869 ecr 3156500808], length 224
03:25:45.038948 IP 167.99.185.35.22 > 162.243.188.66.27755: Flags [P.], seq 15488:15552, ack 1, win 502, options [nop,nop,TS val 2243019869 ecr 3156500808], length 64
03:25:45.039000 IP 167.99.185.35.22 > 162.243.188.66.27755: Flags [P.], seq 15552:15776, ack 1, win 502, options [nop,nop,TS val 2243019869 ecr 3156500808], length 224
03:25:45.039039 IP 167.99.185.35.22 > 162.243.188.66.27755: Flags [P.], seq 15776:15840, ack 1, win 502, options [nop,nop,TS val 2243019869 ecr 3156500808], length 64
03:25:45.039093 IP 167.99.185.35.22 > 162.243.188.66.27755: Flags [P.], seq 15840:16064, ack 1, win 502, options [nop,nop,TS val 2243019869 ecr 3156500808], length 224
03:25:45.039130 IP 167.99.185.35.22 > 162.243.188.66.27755: Flags [P.], seq 16064:16128, ack 1, win 502, options [nop,nop,TS val 2243019869 ecr 3156500808], length 64
03:25:45.039182 IP 167.99.185.35.22 > 162.243.188.66.27755: Flags [P.], seq 16128:16352, ack 1, win 502, options [nop,nop,TS val 2243019869 ecr 3156500808], length 224
03:25:45.039220 IP 167.99.185.35.22 > 162.243.188.66.27755: Flags [P.], seq 16352:16416, ack 1, win 502, options [nop,nop,TS val 2243019869 ecr 3156500808], length 64
03:25:45.039272 IP 167.99.185.35.22 > 162.243.188.66.27755: Flags [P.], seq 16416:16640, ack 1, win 502, options [nop,nop,TS val 2243019869 ecr 3156500808], length 224
03:25:45.039310 IP 167.99.185.35.22 > 162.243.188.66.27755: Flags [P.], seq 16640:16704, ack 1, win 502, options [nop,nop,TS val 2243019869 ecr 3156500808], length 64
03:25:45.039363 IP 167.99.185.35.22 > 162.243.188.66.27755: Flags [P.], seq 16704:16928, ack 1, win 502, options [nop,nop,TS val 2243019869 ecr 3156500808], length 224
03:25:45.039402 IP 167.99.185.35.22 > 162.243.188.66.27755: Flags [P.], seq 16928:16992, ack 1, win 502, options [nop,nop,TS val 2243019869 ecr 3156500808], length 64
03:25:45.039456 IP 167.99.185.35.22 > 162.243.188.66.27755: Flags [P.], seq 16992:17216, ack 1, win 502, options [nop,nop,TS val 2243019869 ecr 3156500808], length 224
03:25:45.039493 IP 167.99.185.35.22 > 162.243.188.66.27755: Flags [P.], seq 17216:17280, ack 1, win 502, options [nop,nop,TS val 2243019869 ecr 3156500808], length 64
03:25:45.039544 IP 167.99.185.35.22 > 162.243.188.66.27755: Flags [P.], seq 17280:17504, ack 1, win 502, options [nop,nop,TS val 2243019870 ecr 3156500808], length 224
03:25:45.039581 IP 167.99.185.35.22 > 162.243.188.66.27755: Flags [P.], seq 17504:17568, ack 1, win 502, options [nop,nop,TS val 2243019870 ecr 3156500808], length 64
03:25:45.039633 IP 167.99.185.35.22 > 162.243.188.66.27755: Flags [P.], seq 17568:17792, ack 1, win 502, options [nop,nop,TS val 2243019870 ecr 3156500808], length 224
03:25:45.039670 IP 167.99.185.35.22 > 162.243.188.66.27755: Flags [P.], seq 17792:17856, ack 1, win 502, options [nop,nop,TS val 2243019870 ecr 3156500808], length 64
03:25:45.039720 IP 167.99.185.35.22 > 162.243.188.66.27755: Flags [P.], seq 17856:18080, ack 1, win 502, options [nop,nop,TS val 2243019870 ecr 3156500808], length 224
03:25:45.039758 IP 167.99.185.35.22 > 162.243.188.66.27755: Flags [P.], seq 18080:18144, ack 1, win 502, options [nop,nop,TS val 2243019870 ecr 3156500808], length 64
03:25:45.039809 IP 167.99.185.35.22 > 162.243.188.66.27755: Flags [P.], seq 18144:18368, ack 1, win 502, options [nop,nop,TS val 2243019870 ecr 3156500808], length 224
03:25:45.039845 IP 167.99.185.35.22 > 162.243.188.66.27755: Flags [P.], seq 18368:18432, ack 1, win 502, options [nop,nop,TS val 2243019870 ecr 3156500808], length 64
03:25:45.039896 IP 167.99.185.35.22 > 162.243.188.66.27755: Flags [P.], seq 18432:18656, ack 1, win 502, options [nop,nop,TS val 2243019870 ecr 3156500808], length 224
03:25:45.039938 IP 167.99.185.35.22 > 162.243.188.66.27755: Flags [P.], seq 18656:18720, ack 1, win 502, options [nop,nop,TS val 2243019870 ecr 3156500808], length 64
03:25:45.039989 IP 167.99.185.35.22 > 162.243.188.66.27755: Flags [P.], seq 18720:18944, ack 1, win 502, options [nop,nop,TS val 2243019870 ecr 3156500808], length 224
03:25:45.040043 IP 167.99.185.35.22 > 162.243.188.66.27755: Flags [P.], seq 18944:19008, ack 1, win 502, options [nop,nop,TS val 2243019870 ecr 3156500808], length 64
03:25:45.040096 IP 167.99.185.35.22 > 162.243.188.66.27755: Flags [P.], seq 19008:19232, ack 1, win 502, options [nop,nop,TS val 2243019870 ecr 3156500808], length 224
03:25:45.040133 IP 167.99.185.35.22 > 162.243.188.66.27755: Flags [P.], seq 19232:19296, ack 1, win 502, options [nop,nop,TS val 2243019870 ecr 3156500808], length 64
03:25:45.040184 IP 167.99.185.35.22 > 162.243.188.66.27755: Flags [P.], seq 19296:19520, ack 1, win 502, options [nop,nop,TS val 2243019870 ecr 3156500808], length 224
03:25:45.040221 IP 167.99.185.35.22 > 162.243.188.66.27755: Flags [P.], seq 19520:19584, ack 1, win 502, options [nop,nop,TS val 2243019870 ecr 3156500808], length 64
03:25:45.040273 IP 167.99.185.35.22 > 162.243.188.66.27755: Flags [P.], seq 19584:19808, ack 1, win 502, options [nop,nop,TS val 2243019870 ecr 3156500808], length 224
03:25:45.040310 IP 167.99.185.35.22 > 162.243.188.66.27755: Flags [P.], seq 19808:19872, ack 1, win 502, options [nop,nop,TS val 2243019870 ecr 3156500808], length 64
03:25:45.040361 IP 167.99.185.35.22 > 162.243.188.66.27755: Flags [P.], seq 19872:20096, ack 1, win 502, options [nop,nop,TS val 2243019870 ecr 3156500808], length 224
03:25:45.040399 IP 167.99.185.35.22 > 162.243.188.66.27755: Flags [P.], seq 20096:20160, ack 1, win 502, options [nop,nop,TS val 2243019870 ecr 3156500808], length 64
03:25:45.040450 IP 167.99.185.35.22 > 162.243.188.66.27755: Flags [P.], seq 20160:20384, ack 1, win 502, options [nop,nop,TS val 2243019870 ecr 3156500808], length 224
03:25:45.040487 IP 167.99.185.35.22 > 162.243.188.66.27755: Flags [P.], seq 20384:20448, ack 1, win 502, options [nop,nop,TS val 2243019870 ecr 3156500808], length 64
03:25:45.040539 IP 167.99.185.35.22 > 162.243.188.66.27755: Flags [P.], seq 20448:20656, ack 1, win 502, options [nop,nop,TS val 2243019871 ecr 3156500808], length 208
03:25:45.040577 IP 167.99.185.35.22 > 162.243.188.66.27755: Flags [P.], seq 20656:20720, ack 1, win 502, options [nop,nop,TS val 2243019871 ecr 3156500808], length 64
03:25:45.040628 IP 167.99.185.35.22 > 162.243.188.66.27755: Flags [P.], seq 20720:20944, ack 1, win 502, options [nop,nop,TS val 2243019871 ecr 3156500808], length 224
03:25:45.051776 IP 162.243.188.66.27755 > 167.99.185.35.22: Flags [.], ack 13472, win 501, options [nop,nop,TS val 3156500888 ecr 2243019868], length 0
03:25:45.051845 IP 167.99.185.35.22 > 162.243.188.66.27755: Flags [P.], seq 20944:22096, ack 1, win 502, options [nop,nop,TS val 2243019882 ecr 3156500888], length 1152
03:25:45.051914 IP 162.243.188.66.27755 > 167.99.185.35.22: Flags [.], ack 14976, win 501, options [nop,nop,TS val 3156500888 ecr 2243019868], length 0
03:25:45.052457 IP 162.243.188.66.27755 > 167.99.185.35.22: Flags [.], ack 16640, win 501, options [nop,nop,TS val 3156500889 ecr 2243019869], length 0
03:25:45.052978 IP 162.243.188.66.27755 > 167.99.185.35.22: Flags [.], ack 18144, win 501, options [nop,nop,TS val 3156500889 ecr 2243019869], length 0
03:25:45.053544 IP 162.243.188.66.27755 > 167.99.185.35.22: Flags [.], ack 19808, win 501, options [nop,nop,TS val 3156500890 ecr 2243019870], length 0
03:25:45.065607 IP 162.243.188.66.27755 > 167.99.185.35.22: Flags [.], ack 22096, win 501, options [nop,nop,TS val 3156500902 ecr 2243019870], length 0
03:25:45.141791 IP 167.99.185.35.22 > 162.243.188.66.27755: Flags [P.], seq 22096:22320, ack 1, win 502, options [nop,nop,TS val 2243019972 ecr 3156500902], length 224
03:25:45.141857 IP 167.99.185.35.22 > 162.243.188.66.27755: Flags [P.], seq 22320:22384, ack 1, win 502, options [nop,nop,TS val 2243019972 ecr 3156500902], length 64
03:25:45.141903 IP 167.99.185.35.22 > 162.243.188.66.27755: Flags [P.], seq 22384:22608, ack 1, win 502, options [nop,nop,TS val 2243019972 ecr 3156500902], length 224
03:25:45.141934 IP 167.99.185.35.22 > 162.243.188.66.27755: Flags [P.], seq 22608:22672, ack 1, win 502, options [nop,nop,TS val 2243019972 ecr 3156500902], length 64
03:25:45.141978 IP 167.99.185.35.22 > 162.243.188.66.27755: Flags [P.], seq 22672:22896, ack 1, win 502, options [nop,nop,TS val 2243019972 ecr 3156500902], length 224
03:25:45.142008 IP 167.99.185.35.22 > 162.243.188.66.27755: Flags [P.], seq 22896:22960, ack 1, win 502, options [nop,nop,TS val 2243019972 ecr 3156500902], length 64
03:25:45.142049 IP 167.99.185.35.22 > 162.243.188.66.27755: Flags [P.], seq 22960:23184, ack 1, win 502, options [nop,nop,TS val 2243019972 ecr 3156500902], length 224
03:25:45.142078 IP 167.99.185.35.22 > 162.243.188.66.27755: Flags [P.], seq 23184:23248, ack 1, win 502, options [nop,nop,TS val 2243019972 ecr 3156500902], length 64
03:25:45.142121 IP 167.99.185.35.22 > 162.243.188.66.27755: Flags [P.], seq 23248:23472, ack 1, win 502, options [nop,nop,TS val 2243019972 ecr 3156500902], length 224
03:25:45.142150 IP 167.99.185.35.22 > 162.243.188.66.27755: Flags [P.], seq 23472:23536, ack 1, win 502, options [nop,nop,TS val 2243019972 ecr 3156500902], length 64
03:25:45.142191 IP 167.99.185.35.22 > 162.243.188.66.27755: Flags [P.], seq 23536:23760, ack 1, win 502, options [nop,nop,TS val 2243019972 ecr 3156500902], length 224
03:25:45.142221 IP 167.99.185.35.22 > 162.243.188.66.27755: Flags [P.], seq 23760:23824, ack 1, win 502, options [nop,nop,TS val 2243019972 ecr 3156500902], length 64
03:25:45.142263 IP 167.99.185.35.22 > 162.243.188.66.27755: Flags [P.], seq 23824:24048, ack 1, win 502, options [nop,nop,TS val 2243019972 ecr 3156500902], length 224
03:25:45.142309 IP 167.99.185.35.22 > 162.243.188.66.27755: Flags [P.], seq 24048:24112, ack 1, win 502, options [nop,nop,TS val 2243019972 ecr 3156500902], length 64
03:25:45.142377 IP 167.99.185.35.22 > 162.243.188.66.27755: Flags [P.], seq 24112:24336, ack 1, win 502, options [nop,nop,TS val 2243019972 ecr 3156500902], length 224
03:25:45.142409 IP 167.99.185.35.22 > 162.243.188.66.27755: Flags [P.], seq 24336:24400, ack 1, win 502, options [nop,nop,TS val 2243019972 ecr 3156500902], length 64
03:25:45.142464 IP 167.99.185.35.22 > 162.243.188.66.27755: Flags [P.], seq 24400:24624, ack 1, win 502, options [nop,nop,TS val 2243019972 ecr 3156500902], length 224
03:25:45.142507 IP 167.99.185.35.22 > 162.243.188.66.27755: Flags [P.], seq 24624:24688, ack 1, win 502, options [nop,nop,TS val 2243019972 ecr 3156500902], length 64
03:25:45.142564 IP 167.99.185.35.22 > 162.243.188.66.27755: Flags [P.], seq 24688:24912, ack 1, win 502, options [nop,nop,TS val 2243019973 ecr 3156500902], length 224
03:25:45.142595 IP 167.99.185.35.22 > 162.243.188.66.27755: Flags [P.], seq 24912:24976, ack 1, win 502, options [nop,nop,TS val 2243019973 ecr 3156500902], length 64
03:25:45.142637 IP 167.99.185.35.22 > 162.243.188.66.27755: Flags [P.], seq 24976:25200, ack 1, win 502, options [nop,nop,TS val 2243019973 ecr 3156500902], length 224
03:25:45.142667 IP 167.99.185.35.22 > 162.243.188.66.27755: Flags [P.], seq 25200:25264, ack 1, win 502, options [nop,nop,TS val 2243019973 ecr 3156500902], length 64
03:25:45.142708 IP 167.99.185.35.22 > 162.243.188.66.27755: Flags [P.], seq 25264:25488, ack 1, win 502, options [nop,nop,TS val 2243019973 ecr 3156500902], length 224
03:25:45.142738 IP 167.99.185.35.22 > 162.243.188.66.27755: Flags [P.], seq 25488:25552, ack 1, win 502, options [nop,nop,TS val 2243019973 ecr 3156500902], length 64
03:25:45.142778 IP 167.99.185.35.22 > 162.243.188.66.27755: Flags [P.], seq 25552:25776, ack 1, win 502, options [nop,nop,TS val 2243019973 ecr 3156500902], length 224
03:25:45.142808 IP 167.99.185.35.22 > 162.243.188.66.27755: Flags [P.], seq 25776:25840, ack 1, win 502, options [nop,nop,TS val 2243019973 ecr 3156500902], length 64
03:25:45.142848 IP 167.99.185.35.22 > 162.243.188.66.27755: Flags [P.], seq 25840:26064, ack 1, win 502, options [nop,nop,TS val 2243019973 ecr 3156500902], length 224
03:25:45.142901 IP 167.99.185.35.22 > 162.243.188.66.27755: Flags [P.], seq 26064:26352, ack 1, win 502, options [nop,nop,TS val 2243019973 ecr 3156500902], length 288
03:25:45.143181 IP 167.99.185.35.22 > 162.243.188.66.27755: Flags [P.], seq 26352:28144, ack 1, win 502, options [nop,nop,TS val 2243019973 ecr 3156500902], length 1792
03:25:45.143262 IP 167.99.185.35.22 > 162.243.188.66.27755: Flags [P.], seq 28144:28368, ack 1, win 502, options [nop,nop,TS val 2243019973 ecr 3156500902], length 224
03:25:45.143305 IP 167.99.185.35.22 > 162.243.188.66.27755: Flags [P.], seq 28368:28432, ack 1, win 502, options [nop,nop,TS val 2243019973 ecr 3156500902], length 64
03:25:45.143362 IP 167.99.185.35.22 > 162.243.188.66.27755: Flags [P.], seq 28432:28656, ack 1, win 502, options [nop,nop,TS val 2243019973 ecr 3156500902], length 224
03:25:45.143404 IP 167.99.185.35.22 > 162.243.188.66.27755: Flags [P.], seq 28656:28720, ack 1, win 502, options [nop,nop,TS val 2243019973 ecr 3156500902], length 64
03:25:45.143453 IP 167.99.185.35.22 > 162.243.188.66.27755: Flags [P.], seq 28720:28944, ack 1, win 502, options [nop,nop,TS val 2243019973 ecr 3156500902], length 224
03:25:45.143481 IP 167.99.185.35.22 > 162.243.188.66.27755: Flags [P.], seq 28944:29008, ack 1, win 502, options [nop,nop,TS val 2243019973 ecr 3156500902], length 64
03:25:45.143518 IP 167.99.185.35.22 > 162.243.188.66.27755: Flags [P.], seq 29008:29232, ack 1, win 502, options [nop,nop,TS val 2243019974 ecr 3156500902], length 224
03:25:45.143546 IP 167.99.185.35.22 > 162.243.188.66.27755: Flags [P.], seq 29232:29296, ack 1, win 502, options [nop,nop,TS val 2243019974 ecr 3156500902], length 64
03:25:45.143611 IP 167.99.185.35.22 > 162.243.188.66.27755: Flags [P.], seq 29296:29520, ack 1, win 502, options [nop,nop,TS val 2243019974 ecr 3156500902], length 224
03:25:45.143644 IP 167.99.185.35.22 > 162.243.188.66.27755: Flags [P.], seq 29520:29584, ack 1, win 502, options [nop,nop,TS val 2243019974 ecr 3156500902], length 64
03:25:45.143687 IP 167.99.185.35.22 > 162.243.188.66.27755: Flags [P.], seq 29584:29808, ack 1, win 502, options [nop,nop,TS val 2243019974 ecr 3156500902], length 224
03:25:45.143717 IP 167.99.185.35.22 > 162.243.188.66.27755: Flags [P.], seq 29808:29872, ack 1, win 502, options [nop,nop,TS val 2243019974 ecr 3156500902], length 64
03:25:45.143758 IP 167.99.185.35.22 > 162.243.188.66.27755: Flags [P.], seq 29872:30096, ack 1, win 502, options [nop,nop,TS val 2243019974 ecr 3156500902], length 224
03:25:45.143787 IP 167.99.185.35.22 > 162.243.188.66.27755: Flags [P.], seq 30096:30160, ack 1, win 502, options [nop,nop,TS val 2243019974 ecr 3156500902], length 64
03:25:45.143827 IP 167.99.185.35.22 > 162.243.188.66.27755: Flags [P.], seq 30160:30384, ack 1, win 502, options [nop,nop,TS val 2243019974 ecr 3156500902], length 224
03:25:45.143857 IP 167.99.185.35.22 > 162.243.188.66.27755: Flags [P.], seq 30384:30448, ack 1, win 502, options [nop,nop,TS val 2243019974 ecr 3156500902], length 64
03:25:45.143898 IP 167.99.185.35.22 > 162.243.188.66.27755: Flags [P.], seq 30448:30672, ack 1, win 502, options [nop,nop,TS val 2243019974 ecr 3156500902], length 224
03:25:45.143929 IP 167.99.185.35.22 > 162.243.188.66.27755: Flags [P.], seq 30672:30736, ack 1, win 502, options [nop,nop,TS val 2243019974 ecr 3156500902], length 64
03:25:45.143969 IP 167.99.185.35.22 > 162.243.188.66.27755: Flags [P.], seq 30736:30960, ack 1, win 502, options [nop,nop,TS val 2243019974 ecr 3156500902], length 224
03:25:45.143999 IP 167.99.185.35.22 > 162.243.188.66.27755: Flags [P.], seq 30960:31024, ack 1, win 502, options [nop,nop,TS val 2243019974 ecr 3156500902], length 64
03:25:45.144039 IP 167.99.185.35.22 > 162.243.188.66.27755: Flags [P.], seq 31024:31248, ack 1, win 502, options [nop,nop,TS val 2243019974 ecr 3156500902], length 224
03:25:45.144069 IP 167.99.185.35.22 > 162.243.188.66.27755: Flags [P.], seq 31248:31312, ack 1, win 502, options [nop,nop,TS val 2243019974 ecr 3156500902], length 64
03:25:45.144110 IP 167.99.185.35.22 > 162.243.188.66.27755: Flags [P.], seq 31312:31536, ack 1, win 502, options [nop,nop,TS val 2243019974 ecr 3156500902], length 224
03:25:45.144169 IP 167.99.185.35.22 > 162.243.188.66.27755: Flags [P.], seq 31536:31936, ack 1, win 502, options [nop,nop,TS val 2243019974 ecr 3156500902], length 400
03:25:45.144225 IP 167.99.185.35.22 > 162.243.188.66.27755: Flags [P.], seq 31936:32336, ack 1, win 502, options [nop,nop,TS val 2243019974 ecr 3156500902], length 400
03:25:45.144293 IP 167.99.185.35.22 > 162.243.188.66.27755: Flags [P.], seq 32336:32896, ack 1, win 502, options [nop,nop,TS val 2243019974 ecr 3156500902], length 560
03:25:45.144467 IP 167.99.185.35.22 > 162.243.188.66.27755: Flags [P.], seq 32896:33632, ack 1, win 502, options [nop,nop,TS val 2243019974 ecr 3156500902], length 736
03:25:45.144547 IP 167.99.185.35.22 > 162.243.188.66.27755: Flags [P.], seq 33632:34368, ack 1, win 502, options [nop,nop,TS val 2243019975 ecr 3156500902], length 736
03:25:45.144612 IP 167.99.185.35.22 > 162.243.188.66.27755: Flags [P.], seq 34368:34928, ack 1, win 502, options [nop,nop,TS val 2243019975 ecr 3156500902], length 560
03:25:45.144665 IP 167.99.185.35.22 > 162.243.188.66.27755: Flags [P.], seq 34928:35328, ack 1, win 502, options [nop,nop,TS val 2243019975 ecr 3156500902], length 400
03:25:45.144730 IP 167.99.185.35.22 > 162.243.188.66.27755: Flags [P.], seq 35328:35888, ack 1, win 502, options [nop,nop,TS val 2243019975 ecr 3156500902], length 560
03:25:45.144782 IP 167.99.185.35.22 > 162.243.188.66.27755: Flags [P.], seq 35888:36288, ack 1, win 502, options [nop,nop,TS val 2243019975 ecr 3156500902], length 400
03:25:45.144846 IP 167.99.185.35.22 > 162.243.188.66.27755: Flags [P.], seq 36288:36848, ack 1, win 502, options [nop,nop,TS val 2243019975 ecr 3156500902], length 560
03:25:45.144914 IP 167.99.185.35.22 > 162.243.188.66.27755: Flags [P.], seq 36848:37248, ack 1, win 502, options [nop,nop,TS val 2243019975 ecr 3156500902], length 400
03:25:45.144973 IP 167.99.185.35.22 > 162.243.188.66.27755: Flags [P.], seq 37248:37632, ack 1, win 502, options [nop,nop,TS val 2243019975 ecr 3156500902], length 384
03:25:45.145029 IP 167.99.185.35.22 > 162.243.188.66.27755: Flags [P.], seq 37632:38000, ack 1, win 502, options [nop,nop,TS val 2243019975 ecr 3156500902], length 368
03:25:45.145107 IP 167.99.185.35.22 > 162.243.188.66.27755: Flags [P.], seq 38000:38368, ack 1, win 502, options [nop,nop,TS val 2243019975 ecr 3156500902], length 368
03:25:45.145302 IP 167.99.185.35.22 > 162.243.188.66.27755: Flags [P.], seq 38368:38576, ack 1, win 502, options [nop,nop,TS val 2243019975 ecr 3156500902], length 208
03:25:45.154882 IP 162.243.188.66.27755 > 167.99.185.35.22: Flags [.], ack 23760, win 501, options [nop,nop,TS val 3156500992 ecr 2243019972], length 0
03:25:45.155480 IP 162.243.188.66.27755 > 167.99.185.35.22: Flags [.], ack 25264, win 501, options [nop,nop,TS val 3156500993 ecr 2243019972], length 0
03:25:45.155777 IP 162.243.188.66.27755 > 167.99.185.35.22: Flags [.], ack 27800, win 501, options [nop,nop,TS val 3156500993 ecr 2243019973], length 0
03:25:45.156187 IP 162.243.188.66.27755 > 167.99.185.35.22: Flags [.], ack 29296, win 501, options [nop,nop,TS val 3156500993 ecr 2243019973], length 0
03:25:45.156652 IP 162.243.188.66.27755 > 167.99.185.35.22: Flags [.], ack 30960, win 501, options [nop,nop,TS val 3156500994 ecr 2243019974], length 0
03:25:45.156892 IP 162.243.188.66.27755 > 167.99.185.35.22: Flags [.], ack 32896, win 501, options [nop,nop,TS val 3156500994 ecr 2243019974], length 0
03:25:45.157155 IP 162.243.188.66.27755 > 167.99.185.35.22: Flags [.], ack 34368, win 501, options [nop,nop,TS val 3156500994 ecr 2243019974], length 0
03:25:45.157318 IP 162.243.188.66.27755 > 167.99.185.35.22: Flags [.], ack 35328, win 501, options [nop,nop,TS val 3156500994 ecr 2243019975], length 0
03:25:45.157503 IP 162.243.188.66.27755 > 167.99.185.35.22: Flags [.], ack 36288, win 501, options [nop,nop,TS val 3156500994 ecr 2243019975], length 0
03:25:45.157527 IP 162.243.188.66.27755 > 167.99.185.35.22: Flags [.], ack 37248, win 501, options [nop,nop,TS val 3156500995 ecr 2243019975], length 0
03:25:45.157607 IP 162.243.188.66.27755 > 167.99.185.35.22: Flags [.], ack 38000, win 501, options [nop,nop,TS val 3156500995 ecr 2243019975], length 0
03:25:45.197607 IP 167.99.185.35.22 > 162.243.188.66.27755: Flags [P.], seq 38368:38576, ack 1, win 502, options [nop,nop,TS val 2243020028 ecr 3156500995], length 208
03:25:45.198770 IP 162.243.188.66.27755 > 167.99.185.35.22: Flags [.], ack 38576, win 501, options [nop,nop,TS val 3156501036 ecr 2243019975], length 0
03:25:45.210413 IP 162.243.188.66.27755 > 167.99.185.35.22: Flags [.], ack 38576, win 501, options [nop,nop,TS val 3156501047 ecr 2243020028,nop,nop,sack 1 {38368:38576}], length 0
03:25:45.245861 IP 167.99.185.35.22 > 162.243.188.66.27755: Flags [P.], seq 38576:39984, ack 1, win 502, options [nop,nop,TS val 2243020076 ecr 3156501047], length 1408
03:25:45.246103 IP 167.99.185.35.22 > 162.243.188.66.27755: Flags [P.], seq 39984:41728, ack 1, win 502, options [nop,nop,TS val 2243020076 ecr 3156501047], length 1744
03:25:45.246246 IP 167.99.185.35.22 > 162.243.188.66.27755: Flags [P.], seq 41728:42624, ack 1, win 502, options [nop,nop,TS val 2243020076 ecr 3156501047], length 896
03:25:45.246371 IP 167.99.185.35.22 > 162.243.188.66.27755: Flags [P.], seq 42624:43360, ack 1, win 502, options [nop,nop,TS val 2243020076 ecr 3156501047], length 736
03:25:45.246468 IP 167.99.185.35.22 > 162.243.188.66.27755: Flags [P.], seq 43360:43920, ack 1, win 502, options [nop,nop,TS val 2243020076 ecr 3156501047], length 560
03:25:45.246548 IP 167.99.185.35.22 > 162.243.188.66.27755: Flags [P.], seq 43920:44656, ack 1, win 502, options [nop,nop,TS val 2243020077 ecr 3156501047], length 736
03:25:45.246612 IP 167.99.185.35.22 > 162.243.188.66.27755: Flags [P.], seq 44656:45216, ack 1, win 502, options [nop,nop,TS val 2243020077 ecr 3156501047], length 560
03:25:45.246668 IP 167.99.185.35.22 > 162.243.188.66.27755: Flags [P.], seq 45216:45616, ack 1, win 502, options [nop,nop,TS val 2243020077 ecr 3156501047], length 400
03:25:45.246731 IP 167.99.185.35.22 > 162.243.188.66.27755: Flags [P.], seq 45616:46176, ack 1, win 502, options [nop,nop,TS val 2243020077 ecr 3156501047], length 560
03:25:45.246796 IP 167.99.185.35.22 > 162.243.188.66.27755: Flags [P.], seq 46176:46736, ack 1, win 502, options [nop,nop,TS val 2243020077 ecr 3156501047], length 560
03:25:45.246862 IP 167.99.185.35.22 > 162.243.188.66.27755: Flags [P.], seq 46736:47136, ack 1, win 502, options [nop,nop,TS val 2243020077 ecr 3156501047], length 400
03:25:45.246955 IP 167.99.185.35.22 > 162.243.188.66.27755: Flags [P.], seq 47136:47696, ack 1, win 502, options [nop,nop,TS val 2243020077 ecr 3156501047], length 560
03:25:45.247038 IP 167.99.185.35.22 > 162.243.188.66.27755: Flags [P.], seq 47696:48432, ack 1, win 502, options [nop,nop,TS val 2243020077 ecr 3156501047], length 736
03:25:45.247102 IP 167.99.185.35.22 > 162.243.188.66.27755: Flags [P.], seq 48432:48992, ack 1, win 502, options [nop,nop,TS val 2243020077 ecr 3156501047], length 560
03:25:45.247166 IP 167.99.185.35.22 > 162.243.188.66.27755: Flags [P.], seq 48992:49552, ack 1, win 502, options [nop,nop,TS val 2243020077 ecr 3156501047], length 560
03:25:45.247230 IP 167.99.185.35.22 > 162.243.188.66.27755: Flags [P.], seq 49552:50112, ack 1, win 502, options [nop,nop,TS val 2243020077 ecr 3156501047], length 560
03:25:45.247282 IP 167.99.185.35.22 > 162.243.188.66.27755: Flags [P.], seq 50112:50512, ack 1, win 502, options [nop,nop,TS val 2243020077 ecr 3156501047], length 400
03:25:45.247348 IP 167.99.185.35.22 > 162.243.188.66.27755: Flags [P.], seq 50512:51056, ack 1, win 502, options [nop,nop,TS val 2243020077 ecr 3156501047], length 544
03:25:45.247411 IP 167.99.185.35.22 > 162.243.188.66.27755: Flags [P.], seq 51056:51568, ack 1, win 502, options [nop,nop,TS val 2243020077 ecr 3156501047], length 512
03:25:45.247463 IP 167.99.185.35.22 > 162.243.188.66.27755: Flags [P.], seq 51568:51936, ack 1, win 502, options [nop,nop,TS val 2243020077 ecr 3156501047], length 368
03:25:45.247526 IP 167.99.185.35.22 > 162.243.188.66.27755: Flags [P.], seq 51936:52448, ack 1, win 502, options [nop,nop,TS val 2243020078 ecr 3156501047], length 512
03:25:45.247590 IP 167.99.185.35.22 > 162.243.188.66.27755: Flags [P.], seq 52448:52976, ack 1, win 502, options [nop,nop,TS val 2243020078 ecr 3156501047], length 528
03:25:45.247645 IP 167.99.185.35.22 > 162.243.188.66.27755: Flags [P.], seq 52976:53376, ack 1, win 502, options [nop,nop,TS val 2243020078 ecr 3156501047], length 400
03:25:45.258911 IP 162.243.188.66.27755 > 167.99.185.35.22: Flags [.], ack 39984, win 501, options [nop,nop,TS val 3156501096 ecr 2243020076], length 0
03:25:45.258969 IP 162.243.188.66.27755 > 167.99.185.35.22: Flags [.], ack 41728, win 501, options [nop,nop,TS val 3156501096 ecr 2243020076], length 0
03:25:45.258970 IP 162.243.188.66.27755 > 167.99.185.35.22: Flags [.], ack 42624, win 501, options [nop,nop,TS val 3156501096 ecr 2243020076], length 0
03:25:45.259071 IP 162.243.188.66.27755 > 167.99.185.35.22: Flags [.], ack 43360, win 501, options [nop,nop,TS val 3156501096 ecr 2243020076], length 0
03:25:45.259163 IP 162.243.188.66.27755 > 167.99.185.35.22: Flags [.], ack 43920, win 501, options [nop,nop,TS val 3156501096 ecr 2243020076], length 0
03:25:45.259402 IP 162.243.188.66.27755 > 167.99.185.35.22: Flags [.], ack 44656, win 501, options [nop,nop,TS val 3156501096 ecr 2243020077], length 0
03:25:45.259402 IP 162.243.188.66.27755 > 167.99.185.35.22: Flags [.], ack 45216, win 501, options [nop,nop,TS val 3156501096 ecr 2243020077], length 0
03:25:45.259402 IP 162.243.188.66.27755 > 167.99.185.35.22: Flags [.], ack 45616, win 501, options [nop,nop,TS val 3156501096 ecr 2243020077], length 0
03:25:45.259402 IP 162.243.188.66.27755 > 167.99.185.35.22: Flags [.], ack 46176, win 501, options [nop,nop,TS val 3156501096 ecr 2243020077], length 0
03:25:45.259422 IP 162.243.188.66.27755 > 167.99.185.35.22: Flags [.], ack 46736, win 501, options [nop,nop,TS val 3156501096 ecr 2243020077], length 0
03:25:45.259527 IP 162.243.188.66.27755 > 167.99.185.35.22: Flags [.], ack 47136, win 501, options [nop,nop,TS val 3156501096 ecr 2243020077], length 0
03:25:45.259616 IP 162.243.188.66.27755 > 167.99.185.35.22: Flags [.], ack 47696, win 501, options [nop,nop,TS val 3156501097 ecr 2243020077], length 0
03:25:45.259796 IP 162.243.188.66.27755 > 167.99.185.35.22: Flags [.], ack 48432, win 501, options [nop,nop,TS val 3156501097 ecr 2243020077], length 0
03:25:45.259796 IP 162.243.188.66.27755 > 167.99.185.35.22: Flags [.], ack 48992, win 501, options [nop,nop,TS val 3156501097 ecr 2243020077], length 0
03:25:45.259838 IP 162.243.188.66.27755 > 167.99.185.35.22: Flags [.], ack 49552, win 501, options [nop,nop,TS val 3156501097 ecr 2243020077], length 0
03:25:45.259878 IP 162.243.188.66.27755 > 167.99.185.35.22: Flags [.], ack 50512, win 501, options [nop,nop,TS val 3156501097 ecr 2243020077], length 0
03:25:45.260020 IP 162.243.188.66.27755 > 167.99.185.35.22: Flags [.], ack 51568, win 501, options [nop,nop,TS val 3156501097 ecr 2243020077], length 0
03:25:45.260196 IP 162.243.188.66.27755 > 167.99.185.35.22: Flags [.], ack 52448, win 501, options [nop,nop,TS val 3156501097 ecr 2243020077], length 0
03:25:45.260487 IP 162.243.188.66.27755 > 167.99.185.35.22: Flags [.], ack 53376, win 501, options [nop,nop,TS val 3156501097 ecr 2243020078], length 0
03:25:45.349801 IP 167.99.185.35.22 > 162.243.188.66.27755: Flags [P.], seq 53376:53600, ack 1, win 502, options [nop,nop,TS val 2243020180 ecr 3156501097], length 224
03:25:45.349889 IP 167.99.185.35.22 > 162.243.188.66.27755: Flags [P.], seq 53600:54000, ack 1, win 502, options [nop,nop,TS val 2243020180 ecr 3156501097], length 400
03:25:45.349986 IP 167.99.185.35.22 > 162.243.188.66.27755: Flags [P.], seq 54000:54736, ack 1, win 502, options [nop,nop,TS val 2243020180 ecr 3156501097], length 736
03:25:45.350065 IP 167.99.185.35.22 > 162.243.188.66.27755: Flags [P.], seq 54736:55296, ack 1, win 502, options [nop,nop,TS val 2243020180 ecr 3156501097], length 560
03:25:45.350137 IP 167.99.185.35.22 > 162.243.188.66.27755: Flags [P.], seq 55296:55856, ack 1, win 502, options [nop,nop,TS val 2243020180 ecr 3156501097], length 560
03:25:45.350204 IP 167.99.185.35.22 > 162.243.188.66.27755: Flags [P.], seq 55856:56416, ack 1, win 502, options [nop,nop,TS val 2243020180 ecr 3156501097], length 560
03:25:45.350269 IP 167.99.185.35.22 > 162.243.188.66.27755: Flags [P.], seq 56416:56976, ack 1, win 502, options [nop,nop,TS val 2243020180 ecr 3156501097], length 560
03:25:45.350335 IP 167.99.185.35.22 > 162.243.188.66.27755: Flags [P.], seq 56976:57536, ack 1, win 502, options [nop,nop,TS val 2243020180 ecr 3156501097], length 560
03:25:45.350391 IP 167.99.185.35.22 > 162.243.188.66.27755: Flags [P.], seq 57536:57920, ack 1, win 502, options [nop,nop,TS val 2243020180 ecr 3156501097], length 384
03:25:45.350444 IP 167.99.185.35.22 > 162.243.188.66.27755: Flags [P.], seq 57920:58288, ack 1, win 502, options [nop,nop,TS val 2243020180 ecr 3156501097], length 368
03:25:45.350507 IP 167.99.185.35.22 > 162.243.188.66.27755: Flags [P.], seq 58288:58800, ack 1, win 502, options [nop,nop,TS val 2243020180 ecr 3156501097], length 512
03:25:45.350647 IP 167.99.185.35.22 > 162.243.188.66.27755: Flags [P.], seq 58800:59312, ack 1, win 502, options [nop,nop,TS val 2243020181 ecr 3156501097], length 512
03:25:45.350671 IP 167.99.185.35.22 > 162.243.188.66.27755: Flags [P.], seq 59312:59520, ack 1, win 502, options [nop,nop,TS val 2243020181 ecr 3156501097], length 208
03:25:45.350759 IP 167.99.185.35.22 > 162.243.188.66.27755: Flags [P.], seq 59520:60336, ack 1, win 502, options [nop,nop,TS val 2243020181 ecr 3156501097], length 816
03:25:45.350835 IP 167.99.185.35.22 > 162.243.188.66.27755: Flags [P.], seq 60336:60704, ack 1, win 502, options [nop,nop,TS val 2243020181 ecr 3156501097], length 368
03:25:45.350891 IP 167.99.185.35.22 > 162.243.188.66.27755: Flags [P.], seq 60704:61072, ack 1, win 502, options [nop,nop,TS val 2243020181 ecr 3156501097], length 368
03:25:45.350926 IP 167.99.185.35.22 > 162.243.188.66.27755: Flags [P.], seq 61072:61136, ack 1, win 502, options [nop,nop,TS val 2243020181 ecr 3156501097], length 64
03:25:45.362635 IP 162.243.188.66.27755 > 167.99.185.35.22: Flags [.], ack 54000, win 501, options [nop,nop,TS val 3156501200 ecr 2243020180], length 0
03:25:45.362762 IP 162.243.188.66.27755 > 167.99.185.35.22: Flags [.], ack 55296, win 501, options [nop,nop,TS val 3156501200 ecr 2243020180], length 0
03:25:45.362857 IP 162.243.188.66.27755 > 167.99.185.35.22: Flags [.], ack 56416, win 501, options [nop,nop,TS val 3156501200 ecr 2243020180], length 0
03:25:45.363042 IP 162.243.188.66.27755 > 167.99.185.35.22: Flags [.], ack 57536, win 501, options [nop,nop,TS val 3156501200 ecr 2243020180], length 0
03:25:45.363173 IP 162.243.188.66.27755 > 167.99.185.35.22: Flags [.], ack 58288, win 501, options [nop,nop,TS val 3156501200 ecr 2243020180], length 0
03:25:45.363248 IP 162.243.188.66.27755 > 167.99.185.35.22: Flags [.], ack 59312, win 501, options [nop,nop,TS val 3156501200 ecr 2243020180], length 0
03:25:45.363372 IP 162.243.188.66.27755 > 167.99.185.35.22: Flags [.], ack 60336, win 501, options [nop,nop,TS val 3156501200 ecr 2243020181], length 0
03:25:45.401573 IP 167.99.185.35.22 > 162.243.188.66.27755: Flags [P.], seq 61072:61136, ack 1, win 502, options [nop,nop,TS val 2243020232 ecr 3156501200], length 64
03:25:45.404592 IP 162.243.188.66.27755 > 167.99.185.35.22: Flags [.], ack 61136, win 501, options [nop,nop,TS val 3156501241 ecr 2243020181], length 0
03:25:45.414909 IP 162.243.188.66.27755 > 167.99.185.35.22: Flags [.], ack 61136, win 501, options [nop,nop,TS val 3156501251 ecr 2243020232,nop,nop,sack 1 {61072:61136}], length 0
03:25:45.453786 IP 167.99.185.35.22 > 162.243.188.66.27755: Flags [P.], seq 61136:61360, ack 1, win 502, options [nop,nop,TS val 2243020284 ecr 3156501251], length 224
03:25:45.453894 IP 167.99.185.35.22 > 162.243.188.66.27755: Flags [P.], seq 61360:61920, ack 1, win 502, options [nop,nop,TS val 2243020284 ecr 3156501251], length 560
03:25:45.453965 IP 167.99.185.35.22 > 162.243.188.66.27755: Flags [P.], seq 61920:62480, ack 1, win 502, options [nop,nop,TS val 2243020284 ecr 3156501251], length 560
03:25:45.454023 IP 167.99.185.35.22 > 162.243.188.66.27755: Flags [P.], seq 62480:62880, ack 1, win 502, options [nop,nop,TS val 2243020284 ecr 3156501251], length 400
03:25:45.454109 IP 167.99.185.35.22 > 162.243.188.66.27755: Flags [P.], seq 62880:63280, ack 1, win 502, options [nop,nop,TS val 2243020284 ecr 3156501251], length 400
03:25:45.454206 IP 167.99.185.35.22 > 162.243.188.66.27755: Flags [P.], seq 63280:64016, ack 1, win 502, options [nop,nop,TS val 2243020284 ecr 3156501251], length 736
03:25:45.454312 IP 167.99.185.35.22 > 162.243.188.66.27755: Flags [P.], seq 64016:64416, ack 1, win 502, options [nop,nop,TS val 2243020284 ecr 3156501251], length 400
03:25:45.454396 IP 167.99.185.35.22 > 162.243.188.66.27755: Flags [P.], seq 64416:64928, ack 1, win 502, options [nop,nop,TS val 2243020284 ecr 3156501251], length 512
03:25:45.454454 IP 167.99.185.35.22 > 162.243.188.66.27755: Flags [P.], seq 64928:65296, ack 1, win 502, options [nop,nop,TS val 2243020284 ecr 3156501251], length 368
03:25:45.454522 IP 167.99.185.35.22 > 162.243.188.66.27755: Flags [P.], seq 65296:65824, ack 1, win 502, options [nop,nop,TS val 2243020285 ecr 3156501251], length 528
03:25:45.454586 IP 167.99.185.35.22 > 162.243.188.66.27755: Flags [P.], seq 65824:66224, ack 1, win 502, options [nop,nop,TS val 2243020285 ecr 3156501251], length 400
03:25:45.466929 IP 162.243.188.66.27755 > 167.99.185.35.22: Flags [.], ack 61360, win 501, options [nop,nop,TS val 3156501303 ecr 2243020284], length 0
03:25:45.466929 IP 162.243.188.66.27755 > 167.99.185.35.22: Flags [.], ack 61920, win 501, options [nop,nop,TS val 3156501304 ecr 2243020284], length 0
03:25:45.466929 IP 162.243.188.66.27755 > 167.99.185.35.22: Flags [.], ack 62480, win 501, options [nop,nop,TS val 3156501304 ecr 2243020284], length 0
03:25:45.466929 IP 162.243.188.66.27755 > 167.99.185.35.22: Flags [.], ack 62880, win 501, options [nop,nop,TS val 3156501304 ecr 2243020284], length 0
03:25:45.466930 IP 162.243.188.66.27755 > 167.99.185.35.22: Flags [.], ack 63280, win 501, options [nop,nop,TS val 3156501304 ecr 2243020284], length 0
03:25:45.466930 IP 162.243.188.66.27755 > 167.99.185.35.22: Flags [.], ack 64016, win 501, options [nop,nop,TS val 3156501304 ecr 2243020284], length 0
03:25:45.466930 IP 162.243.188.66.27755 > 167.99.185.35.22: Flags [.], ack 64416, win 501, options [nop,nop,TS val 3156501304 ecr 2243020284], length 0
03:25:45.467066 IP 162.243.188.66.27755 > 167.99.185.35.22: Flags [.], ack 64928, win 501, options [nop,nop,TS val 3156501304 ecr 2243020284], length 0
03:25:45.467145 IP 162.243.188.66.27755 > 167.99.185.35.22: Flags [.], ack 65296, win 501, options [nop,nop,TS val 3156501304 ecr 2243020284], length 0
03:25:45.467201 IP 162.243.188.66.27755 > 167.99.185.35.22: Flags [.], ack 66224, win 501, options [nop,nop,TS val 3156501304 ecr 2243020285], length 0
03:25:45.557781 IP 167.99.185.35.22 > 162.243.188.66.27755: Flags [P.], seq 66224:66448, ack 1, win 502, options [nop,nop,TS val 2243020388 ecr 3156501304], length 224
03:25:45.557944 IP 167.99.185.35.22 > 162.243.188.66.27755: Flags [P.], seq 66448:66848, ack 1, win 502, options [nop,nop,TS val 2243020388 ecr 3156501304], length 400
03:25:45.558202 IP 167.99.185.35.22 > 162.243.188.66.27755: Flags [P.], seq 66848:69168, ack 1, win 502, options [nop,nop,TS val 2243020388 ecr 3156501304], length 2320
03:25:45.558291 IP 167.99.185.35.22 > 162.243.188.66.27755: Flags [P.], seq 69168:69840, ack 1, win 502, options [nop,nop,TS val 2243020388 ecr 3156501304], length 672
03:25:45.571356 IP 162.243.188.66.27755 > 167.99.185.35.22: Flags [.], ack 66448, win 501, options [nop,nop,TS val 3156501407 ecr 2243020388], length 0
03:25:45.571357 IP 162.243.188.66.27755 > 167.99.185.35.22: Flags [.], ack 66848, win 501, options [nop,nop,TS val 3156501408 ecr 2243020388], length 0
03:25:45.571624 IP 162.243.188.66.27755 > 167.99.185.35.22: Flags [.], ack 68296, win 501, options [nop,nop,TS val 3156501408 ecr 2243020388], length 0
03:25:45.571674 IP 162.243.188.66.27755 > 167.99.185.35.22: Flags [.], ack 69168, win 501, options [nop,nop,TS val 3156501408 ecr 2243020388], length 0
03:25:45.571716 IP 162.243.188.66.27755 > 167.99.185.35.22: Flags [.], ack 69840, win 501, options [nop,nop,TS val 3156501408 ecr 2243020388], length 0
03:25:45.661805 IP 167.99.185.35.22 > 162.243.188.66.27755: Flags [P.], seq 69840:70064, ack 1, win 502, options [nop,nop,TS val 2243020492 ecr 3156501408], length 224
03:25:45.661954 IP 167.99.185.35.22 > 162.243.188.66.27755: Flags [P.], seq 70064:71088, ack 1, win 502, options [nop,nop,TS val 2243020492 ecr 3156501408], length 1024
03:25:45.662021 IP 167.99.185.35.22 > 162.243.188.66.27755: Flags [P.], seq 71088:71456, ack 1, win 502, options [nop,nop,TS val 2243020492 ecr 3156501408], length 368
03:25:45.675090 IP 162.243.188.66.27755 > 167.99.185.35.22: Flags [.], ack 71456, win 501, options [nop,nop,TS val 3156501512 ecr 2243020492], length 0
03:25:45.765803 IP 167.99.185.35.22 > 162.243.188.66.27755: Flags [P.], seq 71456:71680, ack 1, win 502, options [nop,nop,TS val 2243020596 ecr 3156501512], length 224
03:25:45.765910 IP 167.99.185.35.22 > 162.243.188.66.27755: Flags [P.], seq 71680:72224, ack 1, win 502, options [nop,nop,TS val 2243020596 ecr 3156501512], length 544
03:25:45.781346 IP 162.243.188.66.27755 > 167.99.185.35.22: Flags [.], ack 72224, win 501, options [nop,nop,TS val 3156501618 ecr 2243020596], length 0
03:25:45.869812 IP 167.99.185.35.22 > 162.243.188.66.27755: Flags [P.], seq 72224:72448, ack 1, win 502, options [nop,nop,TS val 2243020700 ecr 3156501618], length 224
03:25:45.869942 IP 167.99.185.35.22 > 162.243.188.66.27755: Flags [P.], seq 72448:72832, ack 1, win 502, options [nop,nop,TS val 2243020700 ecr 3156501618], length 384
03:25:45.882686 IP 162.243.188.66.27755 > 167.99.185.35.22: Flags [.], ack 72832, win 524, options [nop,nop,TS val 3156501720 ecr 2243020700], length 0
03:25:45.973852 IP 167.99.185.35.22 > 162.243.188.66.27755: Flags [P.], seq 72832:73056, ack 1, win 502, options [nop,nop,TS val 2243020804 ecr 3156501720], length 224
03:25:45.973993 IP 167.99.185.35.22 > 162.243.188.66.27755: Flags [P.], seq 73056:73440, ack 1, win 502, options [nop,nop,TS val 2243020804 ecr 3156501720], length 384
03:25:45.987812 IP 162.243.188.66.27755 > 167.99.185.35.22: Flags [.], ack 73056, win 546, options [nop,nop,TS val 3156501824 ecr 2243020804], length 0
03:25:45.987812 IP 162.243.188.66.27755 > 167.99.185.35.22: Flags [.], ack 73440, win 569, options [nop,nop,TS val 3156501824 ecr 2243020804], length 0
03:25:46.077792 IP 167.99.185.35.22 > 162.243.188.66.27755: Flags [P.], seq 73440:73664, ack 1, win 502, options [nop,nop,TS val 2243020908 ecr 3156501824], length 224
03:25:46.077907 IP 167.99.185.35.22 > 162.243.188.66.27755: Flags [P.], seq 73664:74192, ack 1, win 502, options [nop,nop,TS val 2243020908 ecr 3156501824], length 528
03:25:46.092486 IP 162.243.188.66.27755 > 167.99.185.35.22: Flags [.], ack 73664, win 592, options [nop,nop,TS val 3156501929 ecr 2243020908], length 0
03:25:46.092487 IP 162.243.188.66.27755 > 167.99.185.35.22: Flags [.], ack 74192, win 614, options [nop,nop,TS val 3156501929 ecr 2243020908], length 0
03:25:46.181810 IP 167.99.185.35.22 > 162.243.188.66.27755: Flags [P.], seq 74192:74416, ack 1, win 502, options [nop,nop,TS val 2243021012 ecr 3156501929], length 224
03:25:46.181905 IP 167.99.185.35.22 > 162.243.188.66.27755: Flags [P.], seq 74416:74800, ack 1, win 502, options [nop,nop,TS val 2243021012 ecr 3156501929], length 384
03:25:46.181959 IP 167.99.185.35.22 > 162.243.188.66.27755: Flags [P.], seq 74800:75008, ack 1, win 502, options [nop,nop,TS val 2243021012 ecr 3156501929], length 208
03:25:46.194503 IP 162.243.188.66.27755 > 167.99.185.35.22: Flags [.], ack 74416, win 637, options [nop,nop,TS val 3156502031 ecr 2243021012], length 0
03:25:46.194560 IP 162.243.188.66.27755 > 167.99.185.35.22: Flags [.], ack 74800, win 660, options [nop,nop,TS val 3156502032 ecr 2243021012], length 0
03:25:46.194654 IP 162.243.188.66.27755 > 167.99.185.35.22: Flags [.], ack 75008, win 682, options [nop,nop,TS val 3156502032 ecr 2243021012], length 0
^C
350 packets captured
359 packets received by filter
0 packets dropped by kernel
root@lamp-ubuntu-s-1vcpu-1gb-tor1-01:~# 