root@lamp-ubuntu-s-1vcpu-1gb-tor1-01:~# tcpdump -c 5 -i eth0
tcpdump: verbose output suppressed, use -v[v]... for full protocol decode
listening on eth0, link-type EN10MB (Ethernet), snapshot length 262144 bytes
03:11:33.227085 IP lamp-ubuntu-s-1vcpu-1gb-tor1-01.ssh > 162.243.188.66.27755: Flags [P.], seq 3162170109:3162170237, ack 744061438, win 502, options [nop,nop,TS val 2242168057 ecr 3155649056], length 128
03:11:33.227138 IP lamp-ubuntu-s-1vcpu-1gb-tor1-01.ssh > 162.243.188.66.27755: Flags [P.], seq 128:192, ack 1, win 502, options [nop,nop,TS val 2242168057 ecr 3155649056], length 64
03:11:33.227174 IP lamp-ubuntu-s-1vcpu-1gb-tor1-01.ssh > 162.243.188.66.27755: Flags [P.], seq 192:272, ack 1, win 502, options [nop,nop,TS val 2242168057 ecr 3155649056], length 80
03:11:33.227206 IP lamp-ubuntu-s-1vcpu-1gb-tor1-01.ssh > 162.243.188.66.27755: Flags [P.], seq 272:352, ack 1, win 502, options [nop,nop,TS val 2242168057 ecr 3155649056], length 80
03:11:33.227237 IP lamp-ubuntu-s-1vcpu-1gb-tor1-01.ssh > 162.243.188.66.27755: Flags [P.], seq 352:432, ack 1, win 502, options [nop,nop,TS val 2242168057 ecr 3155649056], length 80
5 packets captured
44 packets received by filter
0 packets dropped by kernel
root@lamp-ubuntu-s-1vcpu-1gb-tor1-01:~# 